<!DOCTYPE library [
	<!ELEMENT library (book+)>
	<!ELEMENT book (Title, Summary, Pages, ISBN, Author, Price)>
	<!ELEMENT Title (#PCDATA)>
	<!ELEMENT Summary (#PCDATA)>
	<!ELEMENT Pages (#PCDATA)>
	<!ELEMENT ISBN (#PCDATA)>
	<!ELEMENT Author (#PCDATA)>
	<!ELEMENT Price (#PCDATA)>
]>
